{
    "NIGHTSCOUT": {
        "URL": "https://your-nightscout-site.com",
        "TOKEN": "your-access-token-here",
        "INTERVAL": 60
    },
    "BG": {
        "HIGH": 10,
        "LOW": 3.5,
        "TARGET": {
            "TOP": 8.5,
            "BOTTOM": 4.5
        }
    },
    "WIDGET": {
        "SHOW_AGE": true,
        "AGE_LIMIT": 20,
        "POSITION": {
            "x": 1000,
            "y": 100
        },
        "UNITS_IN_MMOL": true,
        "CALC_TREND": false
    },
    "LAST_UPDATE_REQUEST": "1/1/2000",
    "IS_FIRST_RUN": true,
    "LANGUAGE": "en"
}
